first_name,last_name,email,position,employee_number,college,department,status,is_coop_member
John,Smith,main.jhenidellannemary.benito@cvsu.edu.ph,academic,1001,CEIT,Department of Computer and Electronics Engineering,regular,0
Jane,Doe,main.kyleraven.mabingnay@cvsu.edu.ph,academic,1002,CAS,Department of Biological Sciences,regular,1
Michael,Johnson,main.alejandro.zamora@cvsu.edu.ph,academic,1003,CAFENR,Department of Animal Science,part-time,0
Maki,Dano,main.markanthony.dano@cvsu.edu.ph,academic,1004,CEMDS,Department of Economics,regular,1
Mark Anthony,Maki,mark.anthony.mark233@gmail.com,academic,1005,CED,Department of Science Education,part-time,0