first_name,last_name,email,position,student_number,college,department,course
Raven,Kyle,raven.kyle@cvsu.edu.ph,student,202301001,CEIT,Department of Information Technology,BS Information Technology
Jam,Benito,jam.benito@cvsu.edu.ph,student,202301002,CAS,Department of Biological Sciences,BS Psychology
Alex,Reyes,alex.reyes@cvsu.edu.ph,student,202301003,CON,Department of Nursing,BS Nursing
Ali,Zamora,main.alejandro.zamora@cvsu.edu.ph,student,202301004,CVMBS,Department of Veterinary Medicine,Doctor of Veterinary Medicine
Mark,Anthony,main.kyleraven.mabingnay@cvsu.edu.ph,student,202301005,CED,Department of Teacher Education,BSE English
